{
  "schemaVersion": "1.0",
  "artifactId": "TP-STEP4-GJ-VISUAL-EVIDENCE",
  "taskId": "TP-STEP4-GJ",
  "producer": "IMPLEMENTATION/LOCAL",
  "repository": "husam713/SIRA-Headless",
  "baseline": "e829696e82229cf52d3b3f3f19b0da6693040fcd",
  "candidateHead": null,
  "createdAt": "2026-09-03T00:39:09.404Z",
  "files": [
    {
      "path": "consulting/1440/consulting-live-1440-00.png",
      "sha256": "9f59417cddbd0d5de3077402a4295b03200e4cc05edc8edba37e6601660b9746",
      "size": 40529
    },
    {
      "path": "consulting/1440/consulting-live-1440-01.png",
      "sha256": "a72662cced3b7812561c752bfae26a155f271c1b92dc2504c45469408087c074",
      "size": 79020
    },
    {
      "path": "consulting/1440/consulting-live-1440-02.png",
      "sha256": "d1d85c18e0db8619be89e409ef98c3e4883ea14b35080efb0ea40300f09d94bc",
      "size": 65356
    },
    {
      "path": "consulting/1440/consulting-live-1440-03.png",
      "sha256": "6b530bb12bf5d4c0ab7be7193625bbdda1649851c18159b69b27fa8035240ce7",
      "size": 22544
    },
    {
      "path": "consulting/390/consulting-live-390-00.png",
      "sha256": "3df65b87c6de55f85ca656b1da06c3ff410aaacab0d1f2eed7eb03795abd3a05",
      "size": 24866
    },
    {
      "path": "consulting/390/consulting-live-390-01.png",
      "sha256": "5e047435631c42e3d57ef8362f3caf5aeebf2ab13149b8a63351381acbb68ef2",
      "size": 39065
    },
    {
      "path": "consulting/390/consulting-live-390-02.png",
      "sha256": "fef230b1bd6f7477e0238562c523dffaf0a13f3a3a733695fd88fc78d3d3505e",
      "size": 50779
    },
    {
      "path": "consulting/390/consulting-live-390-03.png",
      "sha256": "ff6655c077203e9b9d08dc8b81ec404b7709aea478269bb4f6ad587cc6744fca",
      "size": 43507
    },
    {
      "path": "consulting/390/consulting-live-390-04.png",
      "sha256": "86943fdea3bee50ada46608d4d28ad9569abd0443e20c5217097f61730d35e7b",
      "size": 25744
    },
    {
      "path": "consulting/768/consulting-live-768-00.png",
      "sha256": "67ce3b7aebf9e18b93a6238361ed4126b4c235c4d7016b82e56f7b33b34c1dff",
      "size": 33009
    },
    {
      "path": "consulting/768/consulting-live-768-01.png",
      "sha256": "b8803f9a037d9a9974d277da2c41f90085ef997a96b3b3651d6f499172a56705",
      "size": 63498
    },
    {
      "path": "consulting/768/consulting-live-768-02.png",
      "sha256": "9736d06f77e2f92e1b3125bbec1db1726f32bf90a91d55e1d5e1f24a03097613",
      "size": 66094
    },
    {
      "path": "consulting/768/consulting-live-768-03.png",
      "sha256": "427946fc02b3d0c84014587fb9c5c2d5430b5150b08518e095373909ab15f77c",
      "size": 32352
    },
    {
      "path": "consulting/1440/consulting-reference-1440-00.png",
      "sha256": "e465863cdcc7452175c0fd586105470b2dedc0b273e095caa8cfc9655206538a",
      "size": 144398
    },
    {
      "path": "consulting/1440/consulting-reference-1440-01.png",
      "sha256": "21628cab1adf0648a9e3178ed649469cbfd44e5b585ab5928a1eabde0b1842eb",
      "size": 87951
    },
    {
      "path": "consulting/1440/consulting-reference-1440-02.png",
      "sha256": "9e9e0b36b4f84017292051e87b4d0422e85ca8abf509df232ded4f2b1e20adcd",
      "size": 77774
    },
    {
      "path": "consulting/1440/consulting-reference-1440-03.png",
      "sha256": "5f68605da12954e4599f894337eb3ebd8b6b673e5005936b619f81a4e93fab83",
      "size": 63931
    },
    {
      "path": "consulting/390/consulting-reference-390-00.png",
      "sha256": "0fb89b7727133ff8bb94f41bf13fa1e19b92abd50bbe911d4881e4da6ad51b6b",
      "size": 56449
    },
    {
      "path": "consulting/390/consulting-reference-390-01.png",
      "sha256": "df315641249644ccd8a84683edd9cb8be85e682bb09c792520e20e38525157d7",
      "size": 41843
    },
    {
      "path": "consulting/390/consulting-reference-390-02.png",
      "sha256": "881d753391af0952e1e2cb8dac15e0f1c844e6a48d5962e366a7ae64aea3cf29",
      "size": 33067
    },
    {
      "path": "consulting/390/consulting-reference-390-03.png",
      "sha256": "cad668540c50675ab1020e04add19f6aa29f2010cc0d93b39d779d1aa4ad2c31",
      "size": 40001
    },
    {
      "path": "consulting/390/consulting-reference-390-04.png",
      "sha256": "1bb9636c8a1459d9a683801850a515e2123272c91df6e30f31c71df844dde319",
      "size": 52394
    },
    {
      "path": "consulting/390/consulting-reference-390-05.png",
      "sha256": "471df2a4c7c4835d312212af22b97e05838baeb28e05ade50d635a4ec6f151d0",
      "size": 24564
    },
    {
      "path": "consulting/768/consulting-reference-768-00.png",
      "sha256": "d35f9c8eb280ec731357fe3218128fcaee93346fb35b25a3788fbc05becc6681",
      "size": 76285
    },
    {
      "path": "consulting/768/consulting-reference-768-01.png",
      "sha256": "26d44c6f599535fa10c6a149e85f412c2b57ca6648a4158622c4342d92adf482",
      "size": 62829
    },
    {
      "path": "consulting/768/consulting-reference-768-02.png",
      "sha256": "af3fb790434010a1933c2d7bdc4db83a888588d8c3e0c79dbb21ec71317005db",
      "size": 59215
    },
    {
      "path": "consulting/768/consulting-reference-768-03.png",
      "sha256": "127793af66d4ea8168bd37c9639b6a9c44814040962dda42549d114cb7e1597f",
      "size": 70698
    },
    {
      "path": "consulting/768/consulting-reference-768-04.png",
      "sha256": "bd27a2f50ff377c14579b1275b76222d53f63091668f0a9d339f601e6ecb28e5",
      "size": 15300
    },
    {
      "path": "healthcare/1440/healthcare-live-1440-00.png",
      "sha256": "25145a556625a43a50fedac30e8814b57a696847f5acd7faba911082b9c796a3",
      "size": 37983
    },
    {
      "path": "healthcare/1440/healthcare-live-1440-01.png",
      "sha256": "0531b2e531fcff7069bc2894f1bb62b326015cf4c8bedcf4ab49933068832da8",
      "size": 47640
    },
    {
      "path": "healthcare/1440/healthcare-live-1440-02.png",
      "sha256": "338eee55cfe0b9474b4ff60085cd733e90381e8f293370f0b77ff4ed0bf76ec3",
      "size": 63002
    },
    {
      "path": "healthcare/1440/healthcare-live-1440-03.png",
      "sha256": "645241b631332282b6b9959a002cbb1bca06290976fbe7c84b1807311ddfb65d",
      "size": 20458
    },
    {
      "path": "healthcare/390/healthcare-live-390-00.png",
      "sha256": "a9aa8dbfb3fb095582b774bf2fcc60d9065d20f0181254b9cd1dddffe2cb2166",
      "size": 18330
    },
    {
      "path": "healthcare/390/healthcare-live-390-01.png",
      "sha256": "dd4543a87d31b7d2f4ba68bcd30586b884fa02f3d0f97a46bea5725d347067e1",
      "size": 39556
    },
    {
      "path": "healthcare/390/healthcare-live-390-02.png",
      "sha256": "8ebfd56ce9df60d61b6124b3d6a3791cab2fb4a1736868eca35b431182119b7c",
      "size": 42358
    },
    {
      "path": "healthcare/390/healthcare-live-390-03.png",
      "sha256": "da23959302853f711b90c951793cac27866dbbc453929764f051e013402b3a55",
      "size": 37944
    },
    {
      "path": "healthcare/390/healthcare-live-390-04.png",
      "sha256": "65d41c61f1b14ece26c78d7b1e832b6705453aaece2a1809e26d0fbfcb5b80ad",
      "size": 24520
    },
    {
      "path": "healthcare/768/healthcare-live-768-00.png",
      "sha256": "fd29e65b9bed9516a0487e5bf2887c1469eeecb6afd3b505077bd8daa7cfddf6",
      "size": 24027
    },
    {
      "path": "healthcare/768/healthcare-live-768-01.png",
      "sha256": "8ce9b60fbe30a39f3c7cc494d1246f8aaa0ebbc23be8eab269ecc5119719cceb",
      "size": 48264
    },
    {
      "path": "healthcare/768/healthcare-live-768-02.png",
      "sha256": "d6043483229b6b2b8f0c1531171e9e1e474b72e74378c4b75e61b7ba8d4ef0db",
      "size": 50047
    },
    {
      "path": "healthcare/768/healthcare-live-768-03.png",
      "sha256": "ca66a9ad70559bc61720d0820a402e871b5ab94a929cc40e938fd812bb8df573",
      "size": 30000
    },
    {
      "path": "healthcare/1440/healthcare-reference-1440-00.png",
      "sha256": "05fe3669e894a7a70861112af4ddf8e777aeb6a47225666d35cf6739deecfa10",
      "size": 147252
    },
    {
      "path": "healthcare/1440/healthcare-reference-1440-01.png",
      "sha256": "b3f7962db1846d52693df0626da6b3b55d726d9d9ba66b597a890385fc28dcc6",
      "size": 105972
    },
    {
      "path": "healthcare/1440/healthcare-reference-1440-02.png",
      "sha256": "437769d9a76996c7bc9640131bd477607707c2da2a6fea7894efd6998bbd688b",
      "size": 80195
    },
    {
      "path": "healthcare/1440/healthcare-reference-1440-03.png",
      "sha256": "d8c1a02cd9ed65ab350ad3a96ed0cd0485b6576a98fbe40adf98861d75ee2153",
      "size": 58569
    },
    {
      "path": "healthcare/390/healthcare-reference-390-00.png",
      "sha256": "3fa1d98cbc8f2faa0c495e92616ee8e44a36395ea57522b06ee1d55aec6d8bf7",
      "size": 66277
    },
    {
      "path": "healthcare/390/healthcare-reference-390-01.png",
      "sha256": "1c66981f1d5b62f66c6216491093ba7faae141f1025937bb237ccca8addcde19",
      "size": 46690
    },
    {
      "path": "healthcare/390/healthcare-reference-390-02.png",
      "sha256": "943771af471e119c0cf5f8461ac9ad3a4919c5e4d8c1e62e66c3a4729fe3c1f6",
      "size": 38636
    },
    {
      "path": "healthcare/390/healthcare-reference-390-03.png",
      "sha256": "535a685cd91695de49664d34bd482015552e7a59bdcd6c33095a61a83dc5752e",
      "size": 38866
    },
    {
      "path": "healthcare/390/healthcare-reference-390-04.png",
      "sha256": "405ca9ba457152ad1fed262b647d89b8cbc7fc381c75cb6faa17f2019430276a",
      "size": 52237
    },
    {
      "path": "healthcare/390/healthcare-reference-390-05.png",
      "sha256": "1d72b53e7bf5d6931e3fac6acde0c0ac5dde1595c441611156135491570b876c",
      "size": 37120
    },
    {
      "path": "healthcare/768/healthcare-reference-768-00.png",
      "sha256": "5b366e8276aabac4517598b913eda0cf1fe10ece2a78ba080353136e33c48a7f",
      "size": 84621
    },
    {
      "path": "healthcare/768/healthcare-reference-768-01.png",
      "sha256": "fcf6b72ada699eed74707741bd944cbfe5f152b8415ffa2ce8370af25a0b205f",
      "size": 69568
    },
    {
      "path": "healthcare/768/healthcare-reference-768-02.png",
      "sha256": "473b590d13d902155feddba6d23a28e3e188fbc489cf43f39be478adb0a6758b",
      "size": 52306
    },